{
	"$schema": "../board-definition.schema.json",
	"boardImageFileName": "board.webp",
	"wireDiagramFileName": "wiring.drawio.svg",
	"isToolboard": true,
	"name": "FLY-SHT36",
	"manufacturer": "Mellow",
	"id": "mellow-fly-sht-36",
	"firmwareBinaryName": "firmware-mellow-fly-sht-36.bin",
	"compileScript": "compile.sh",
	"flashScript": "flash.sh",
	"flashInstructions": "After initial flashing, make sure the boot0 jumper is not inserted.",
	"documentationLink": "https://github.com/coolio986/ratical/docs/boards/mellow/fly-sht-36",
	"thermistorPullup": 2200,
	"driverCount": 1,
	"integratedDrivers": {
		"extruder": "MELLOW-FLY-TMC2209"
	},
	"dfu": {
		"flashDevice": "0483:df11",
		"dfuBootImage": "dfubooting.png",
		"instructions": [
			"Add the jumper as shown in the picture",
			"Connect the board via USB to the Raspberry Pi",
			"Make sure the board is powered on",
			"If the board was already connected and powered when you inserted the jumper, click the boot button on the board."
		],
		"hasBoot0Jumper": true
	},
	"ADXL345SPI": {
		"cs_pin": "PA4",
		"hardware": {
			"bus": "spi1"
		}
	}
}
