{
	"$schema": "../board-definition.schema.json",
	"boardImageFileName": "board.webp",
	"manualFileName": "manual.pdf",
	"wireDiagramFileName": "wiring.drawio.svg",
	"name": "SKR 3 EZ H743",
	"manufacturer": "BIGTREETECH",
	"id": "btt-skr-3-ez",
	"firmwareBinaryName": "firmware-btt-skr-3-ez.bin",
	"compileScript": "compile.sh",
	"flashScript": "flash.sh",
	"documentationLink": "https://github.com/coolio986/ratical/docs/boards/btt/skr-3-ez",
	"driverCount": 5,
	"driverVoltages": [24, 36, 48, 56],
	"alternativePT1000Resistor": 1000,
	"dfu": {
		"flashDevice": "0483:df11",
		"dfuBootImage": "dfubooting.png",
		"instructions": [
			"Connect the board via USB to the Raspberry Pi",
			"Make sure the board is powered (you can use usb power by placing a jumper on the VBUS pins)",
			"Press and hold the BOOT button on the board.",
			"Press and release the RESET button on the board.",
			"Release the BOOT button."
		],
		"hasBoot0Jumper": false
	},
	"extruderlessConfig": "config-3z.cfg",
	"ADXL345SPI": {
		"cs_pin": "PB12",
		"hardware": {
			"bus": "spi2"
		}
	},
	"stepperSPI": {
		"software": {
			"sclk": "PE14",
			"mosi": "PE13",
			"miso": "PE15"
		}
	},
	"motorSlots": {
		"X": {
			"title": "X",
			"enable_pin": "PD6",
			"step_pin": "PD4",
			"dir_pin": "PD3",
			"uart_pin": "PD5",
			"cs_pin": "PD5",
			"diag_pin": "PC1",
			"endstop_pin": "PC1",
			"spi_software_mosi_pin": "PE13",
			"spi_software_miso_pin": "PE15",
			"spi_software_sclk_pin": "PE14"
		},
		"Y": {
			"title": "Y",
			"enable_pin": "PD1",
			"step_pin": "PA15",
			"dir_pin": "PA8",
			"uart_pin": "PD0",
			"cs_pin": "PD0",
			"diag_pin": "PC3",
			"endstop_pin": "PC3",
			"spi_software_mosi_pin": "PE13",
			"spi_software_miso_pin": "PE15",
			"spi_software_sclk_pin": "PE14"
		},
		"Z": {
			"title": "Z",
			"enable_pin": "PE0",
			"step_pin": "PE2",
			"dir_pin": "PE3",
			"uart_pin": "PE1",
			"cs_pin": "PE1",
			"diag_pin": "PC0",
			"endstop_pin": "PC0",
			"spi_software_mosi_pin": "PE13",
			"spi_software_miso_pin": "PE15",
			"spi_software_sclk_pin": "PE14"
		},
		"E0": {
			"title": "E0",
			"enable_pin": "PC7",
			"step_pin": "PD15",
			"dir_pin": "PD14",
			"uart_pin": "PC6",
			"cs_pin": "PC6",
			"diag_pin": "PC2",
			"endstop_pin": "PC2",
			"spi_software_mosi_pin": "PE13",
			"spi_software_miso_pin": "PE15",
			"spi_software_sclk_pin": "PE14"
		},
		"E1": {
			"title": "E1",
			"enable_pin": "PD13",
			"step_pin": "PD11",
			"dir_pin": "PD10",
			"uart_pin": "PD12",
			"cs_pin": "PD12",
			"diag_pin": "PA0",
			"endstop_pin": "PA0",
			"spi_software_mosi_pin": "PE13",
			"spi_software_miso_pin": "PE15",
			"spi_software_sclk_pin": "PE14"
		}
	}
}
