{
	"$schema": "../board-definition.schema.json",
	"boardImageFileName": "board.webp",
	"name": "Spider v1.1",
	"manufacturer": "Fysetc",
	"id": "fysetc-spider",
	"firmwareBinaryName": "firmware-fysetc-spider.bin",
	"firmwareOptions": ["WANT_STEPPER_OPTIMIZED_BOTH_EDGE", "HIGH_PREC_STEP"],
	"compileScript": "compile.sh",
	"flashScript": "flash.sh",
	"driverCount": 8,
	"driverVoltages": [24],
	"flashInstructions": "Flashing only works if Fysetc's 32-bit bootloader is installed on the MCU (default since Spider v1.1).",
	"documentationLink": "https://github.com/coolio986/ratical/docs/boards/fysetc/spider-11",
	"ADXL345SPI": {
		"cs_pin": "PA4",
		"software": {
			"sclk": "PA5",
			"mosi": "PA7",
			"miso": "PA6"
		}
	},
	"stepperSPI": {
		"software": {
			"sclk": "PE12",
			"mosi": "PE14",
			"miso": "PE13"
		}
	},
	"motorSlots": {
		"X-MOT": {
			"title": "X-MOT",
			"enable_pin": "PE9",
			"step_pin": "PE11",
			"dir_pin": "PE10",
			"uart_pin": "PE7",
			"cs_pin": "PE7",
			"diag_pin": "PB14",
			"endstop_pin": "PB14",
			"spi_software_mosi_pin": "PE14",
			"spi_software_miso_pin": "PE13",
			"spi_software_sclk_pin": "PE12"
		},
		"Y-MOT": {
			"title": "Y-MOT",
			"enable_pin": "PD9",
			"step_pin": "PD8",
			"dir_pin": "PB12",
			"uart_pin": "PE15",
			"cs_pin": "PE15",
			"diag_pin": "PB13",
			"endstop_pin": "PB13",
			"spi_software_mosi_pin": "PE14",
			"spi_software_miso_pin": "PE13",
			"spi_software_sclk_pin": "PE12"
		},
		"Z-MOT": {
			"title": "Z-MOT",
			"enable_pin": "PD15",
			"step_pin": "PD14",
			"dir_pin": "PD13",
			"uart_pin": "PD10",
			"cs_pin": "PD10",
			"diag_pin": "PA0",
			"endstop_pin": "PA0",
			"spi_software_mosi_pin": "PE14",
			"spi_software_miso_pin": "PE13",
			"spi_software_sclk_pin": "PE12"
		},
		"E0-MOT": {
			"title": "MOTOR 3",
			"enable_pin": "PD4",
			"step_pin": "PD5",
			"dir_pin": "PD6",
			"uart_pin": "PD7",
			"cs_pin": "PD7",
			"diag_pin": "PA1",
			"endstop_pin": "PA1",
			"spi_software_mosi_pin": "PE14",
			"spi_software_miso_pin": "PE13",
			"spi_software_sclk_pin": "PE12"
		},
		"E1-MOT": {
			"title": "E1-MOT",
			"enable_pin": "PE5",
			"step_pin": "PE6",
			"dir_pin": "PC13",
			"uart_pin": "PC14",
			"cs_pin": "PC14",
			"diag_pin": "PA2",
			"endstop_pin": "PA2",
			"spi_software_mosi_pin": "PE14",
			"spi_software_miso_pin": "PE13",
			"spi_software_sclk_pin": "PE12"
		},
		"E2-MOT": {
			"title": "E2-MOT",
			"enable_pin": "PE3",
			"step_pin": "PE2",
			"dir_pin": "PE4",
			"uart_pin": "PC15",
			"cs_pin": "PC15",
			"diag_pin": "PA3",
			"endstop_pin": "PA3",
			"spi_software_mosi_pin": "PE14",
			"spi_software_miso_pin": "PE13",
			"spi_software_sclk_pin": "PE12"
		},
		"E3-MOT": {
			"title": "E3-MOT",
			"enable_pin": "PE8",
			"step_pin": "PD12",
			"dir_pin": "PC4",
			"uart_pin": "PA15",
			"cs_pin": "PA15",
			"spi_software_mosi_pin": "PE14",
			"spi_software_miso_pin": "PE13",
			"spi_software_sclk_pin": "PE12"
		},
		"E4-MOT": {
			"title": "E4-MOT",
			"enable_pin": "PC5",
			"step_pin": "PE1",
			"dir_pin": "PE0",
			"uart_pin": "PD11",
			"cs_pin": "PD11",
			"spi_software_mosi_pin": "PE14",
			"spi_software_miso_pin": "PE13",
			"spi_software_sclk_pin": "PE12"
		}
	}
}
