{
	"$schema": "../board-definition.schema.json",
	"boardImageFileName": "board.webp",
	"manualFileName": "manual.pdf",
	"name": "SKR Pro v1.2",
	"manufacturer": "BIGTREETECH",
	"id": "btt-skr-pro-12",
	"firmwareBinaryName": "firmware-btt-skr-pro-12.bin",
	"compileScript": "compile.sh",
	"flashScript": "flash.sh",
	"driverCount": 6,
	"driverVoltages": [24],
	"flashInstructions": "Flashing only works if there's a properly formatted (FAT16 or FAT32 with a small blocksize) micro SD card in the SKR Pro's SD Card slot. The smaller the SD card the better, a cheap 128mb TF-card is perfect.",
	"documentationLink": "https://github.com/coolio986/ratical/docs/boards/btt/skr-pro-12",
	"ADXL345SPI": {
		"cs_pin": "PA15",
		"hardware": {
			"bus": "spi3a"
		}
	},
	"stepperSPI": {
		"software": {
			"sclk": "PC10",
			"mosi": "PC12",
			"miso": "PC11"
		}
	},
	"motorSlots": {
		"X": {
			"title": "X",
			"enable_pin": "PF2",
			"step_pin": "PE9",
			"dir_pin": "PF1",
			"uart_pin": "PC13",
			"cs_pin": "PC13",
			"diag_pin": "PB10",
			"endstop_pin": "PB10",
			"spi_software_mosi_pin": "PC12",
			"spi_software_miso_pin": "PC11",
			"spi_software_sclk_pin": "PC10"
		},
		"Y": {
			"title": "Y",
			"enable_pin": "PD7",
			"step_pin": "PE11",
			"dir_pin": "PE8",
			"uart_pin": "PE3",
			"cs_pin": "PE3",
			"diag_pin": "PE12",
			"endstop_pin": "PE12",
			"spi_software_mosi_pin": "PC12",
			"spi_software_miso_pin": "PC11",
			"spi_software_sclk_pin": "PC10"
		},
		"Z": {
			"title": "Z",
			"enable_pin": "PC0",
			"step_pin": "PE13",
			"dir_pin": "PC2",
			"uart_pin": "PE1",
			"cs_pin": "PE1",
			"diag_pin": "PG8",
			"endstop_pin": "PG8",
			"spi_software_mosi_pin": "PC12",
			"spi_software_miso_pin": "PC11",
			"spi_software_sclk_pin": "PC10"
		},
		"E0": {
			"title": "E0",
			"enable_pin": "PC3",
			"step_pin": "PE14",
			"dir_pin": "PA0",
			"uart_pin": "PD4",
			"cs_pin": "PD4",
			"diag_pin": "PE15",
			"endstop_pin": "PE15",
			"spi_software_mosi_pin": "PC12",
			"spi_software_miso_pin": "PC11",
			"spi_software_sclk_pin": "PC10"
		},
		"E1": {
			"title": "E1",
			"enable_pin": "PA3",
			"step_pin": "PD15",
			"dir_pin": "PE7",
			"uart_pin": "PD1",
			"cs_pin": "PD1",
			"diag_pin": "PE10",
			"endstop_pin": "PE10",
			"spi_software_mosi_pin": "PC12",
			"spi_software_miso_pin": "PC11",
			"spi_software_sclk_pin": "PC10"
		},
		"E2": {
			"title": "E2",
			"enable_pin": "PF0",
			"step_pin": "PD13",
			"dir_pin": "PG9",
			"uart_pin": "PD6",
			"cs_pin": "PD6",
			"diag_pin": "PG5",
			"endstop_pin": "PG5",
			"spi_software_mosi_pin": "PC12",
			"spi_software_miso_pin": "PC11",
			"spi_software_sclk_pin": "PC10"
		}
	}
}
