{
	"$schema": "../board-definition.schema.json",
	"boardImageFileName": "board.webp",
	"manualFileName": "manual.pdf",
	"wireDiagramFileName": "wiring.drawio.svg",
	"name": "Kraken",
	"manufacturer": "BIGTREETECH",
	"id": "btt-kraken",
	"firmwareBinaryName": "firmware-btt-kraken.bin",
	"compileScript": "compile.sh",
	"flashScript": "flash.sh",
	"flashInstructions": "Flashing only works if the SD card slot on the Octopus is empty.",
	"documentationLink": "https://github.com/coolio986/ratical/docs/boards/btt/btt-kraken",
	"driverCount": 8,
	"driverVoltages": [24, 36, 48, 56],
	"fourPinFanConnectorCount": 2,
	"dfu": {
		"flashDevice": "0483:df11",
		"dfuBootImage": "dfubooting.drawio.png",
		"instructions": [
			"Connect the board via USB to the Raspberry Pi",
			"Make sure the board is powered (you can use usb power by placing a jumper on the VBUS pins)",
			"Press and hold the BOOT0 button on the board.",
			"Press and release the RESET button on the board.",
			"Release the BOOT0 button."
		],
		"hasBoot0Jumper": false
	},
	"ADXL345SPI": {
		"cs_pin": "PE10",
		"software": {
			"sclk": "PE12",
			"mosi": "PE14",
			"miso": "PE13"
		}
	},
	"stepperSPI": {
		"software": {
			"sclk": "PE12",
			"mosi": "PE14",
			"miso": "PE13"
		}
	},
	"integratedDrivers": {
		"MOTOR1": "BTT-KRAKEN-2160-PLUS",
		"MOTOR2": "BTT-KRAKEN-2160-PLUS",
		"MOTOR3": "BTT-KRAKEN-2160-PLUS",
		"MOTOR4": "BTT-KRAKEN-2160-PLUS",
		"MOTOR5": "BTT-KRAKEN-2160",
		"MOTOR6": "BTT-KRAKEN-2160",
		"MOTOR7": "BTT-KRAKEN-2160",
		"MOTOR8": "BTT-KRAKEN-2160"
	},
	"motorSlots": {
		"MOTOR1": {
			"title": "MOTOR 1",
			"enable_pin": "PE6",
			"step_pin": "PC14",
			"dir_pin": "PC13",
			"cs_pin": "PD6",
			"diag_pin": "PC15",
			"endstop_pin": "PC15",
			"spi_software_mosi_pin": "PC8",
			"spi_software_miso_pin": "PC7",
			"spi_software_sclk_pin": "PC6"
		},
		"MOTOR2": {
			"title": "MOTOR 2",
			"enable_pin": "PE3",
			"step_pin": "PE5",
			"dir_pin": "PE4",
			"cs_pin": "PD5",
			"diag_pin": "PF0",
			"endstop_pin": "PF0",
			"spi_software_mosi_pin": "PC8",
			"spi_software_miso_pin": "PC7",
			"spi_software_sclk_pin": "PC6"
		},
		"MOTOR3": {
			"title": "MOTOR 3",
			"enable_pin": "PE0",
			"step_pin": "PE2",
			"dir_pin": "PE1",
			"cs_pin": "PD4",
			"diag_pin": "PF1",
			"endstop_pin": "PF1",
			"spi_software_mosi_pin": "PC8",
			"spi_software_miso_pin": "PC7",
			"spi_software_sclk_pin": "PC6"
		},
		"MOTOR4": {
			"title": "MOTOR 4",
			"enable_pin": "PB7",
			"step_pin": "PB9",
			"dir_pin": "PB8",
			"cs_pin": "PD3",
			"diag_pin": "PF2",
			"endstop_pin": "PF2",
			"spi_software_mosi_pin": "PC8",
			"spi_software_miso_pin": "PC7",
			"spi_software_sclk_pin": "PC6"
		},
		"MOTOR5": {
			"title": "MOTOR 5",
			"enable_pin": "PG13",
			"step_pin": "PG9",
			"dir_pin": "PG10",
			"cs_pin": "PD2",
			"diag_pin": "PF3",
			"endstop_pin": "PF3",
			"spi_software_mosi_pin": "PC8",
			"spi_software_miso_pin": "PC7",
			"spi_software_sclk_pin": "PC6"
		},
		"MOTOR6": {
			"title": "MOTOR 6",
			"enable_pin": "PG12",
			"step_pin": "PG11",
			"dir_pin": "PD7",
			"cs_pin": "PA15",
			"diag_pin": "PF4",
			"endstop_pin": "PF4",
			"spi_software_mosi_pin": "PC8",
			"spi_software_miso_pin": "PC7",
			"spi_software_sclk_pin": "PC6"
		},
		"MOTOR7": {
			"title": "MOTOR 7",
			"enable_pin": "PB5",
			"step_pin": "PB4",
			"dir_pin": "PB3",
			"cs_pin": "PA9",
			"diag_pin": "PF10",
			"endstop_pin": "PF10",
			"spi_software_mosi_pin": "PC8",
			"spi_software_miso_pin": "PC7",
			"spi_software_sclk_pin": "PC6"
		},
		"MOTOR8": {
			"title": "MOTOR 8",
			"enable_pin": "PG14",
			"step_pin": "PG15",
			"dir_pin": "PB6",
			"cs_pin": "PA10",
			"diag_pin": "PC0",
			"endstop_pin": "PC0",
			"spi_software_mosi_pin": "PC8",
			"spi_software_miso_pin": "PC7",
			"spi_software_sclk_pin": "PC6"
		}
	}
}
