{
	"$schema": "../board-definition.schema.json",
	"boardImageFileName": "board.webp",
	"manualFileName": "manual.pdf",
	"wireDiagramFileName": "wiring.drawio.svg",
	"name": "SKR 3 H723",
	"manufacturer": "BIGTREETECH",
	"id": "btt-skr-3-h723",
	"firmwareBinaryName": "firmware-btt-skr-3-h723.bin",
	"compileScript": "compile.sh",
	"flashScript": "flash.sh",
	"driverCount": 5,
	"driverVoltages": [24],
	"alternativePT1000Resistor": 1000,
	"documentationLink": "https://github.com/coolio986/ratical/docs/boards/btt/skr-3",
	"ADXL345SPI": {
		"cs_pin": "PB12",
		"software": {
			"sclk": "PB13",
			"mosi": "PB15",
			"miso": "PB14"
		}
	},
	"stepperSPI": {
		"software": {
			"sclk": "PE14",
			"mosi": "PE13",
			"miso": "PE15"
		}
	},
	"motorSlots": {
		"X": {
			"title": "X",
			"enable_pin": "PD6",
			"step_pin": "PD4",
			"dir_pin": "PD3",
			"uart_pin": "PD5",
			"cs_pin": "PD5",
			"diag_pin": "PC1",
			"endstop_pin": "PC1",
			"spi_software_mosi_pin": "PE13",
			"spi_software_miso_pin": "PE15",
			"spi_software_sclk_pin": "PE14"
		},
		"Y": {
			"title": "Y",
			"enable_pin": "PD1",
			"step_pin": "PA15",
			"dir_pin": "PA8",
			"uart_pin": "PD0",
			"cs_pin": "PD0",
			"diag_pin": "PC3",
			"endstop_pin": "PC3",
			"spi_software_mosi_pin": "PE13",
			"spi_software_miso_pin": "PE15",
			"spi_software_sclk_pin": "PE14"
		},
		"Z": {
			"title": "Z",
			"enable_pin": "PE0",
			"step_pin": "PE2",
			"dir_pin": "PE3",
			"uart_pin": "PE1",
			"cs_pin": "PE1",
			"diag_pin": "PC0",
			"endstop_pin": "PC0",
			"spi_software_mosi_pin": "PE13",
			"spi_software_miso_pin": "PE15",
			"spi_software_sclk_pin": "PE14"
		},
		"E0": {
			"title": "E0",
			"enable_pin": "PC7",
			"step_pin": "PD15",
			"dir_pin": "PD14",
			"uart_pin": "PC6",
			"cs_pin": "PC6",
			"diag_pin": "PC2",
			"endstop_pin": "PC2",
			"spi_software_mosi_pin": "PE13",
			"spi_software_miso_pin": "PE15",
			"spi_software_sclk_pin": "PE14"
		},
		"E1": {
			"title": "E1",
			"enable_pin": "PD13",
			"step_pin": "PD11",
			"dir_pin": "PD10",
			"uart_pin": "PD12",
			"cs_pin": "PD12",
			"diag_pin": "PA0",
			"endstop_pin": "PA0",
			"spi_software_mosi_pin": "PE13",
			"spi_software_miso_pin": "PE15",
			"spi_software_sclk_pin": "PE14"
		}
	}
}
