{
	"$schema": "../board-definition.schema.json",
	"name": "Pi",
	"id": "klipper_host_mcu",
	"manufacturer": "Raspberry",
	"isHost": true,
	"serialPath": "/tmp/klipper_host_mcu",
	"firmwareBinaryName": "rpi.elf",
	"compileScript": "compile.sh",
	"flashScript": "flash.sh",
	"driverCount": 0,
	"documentationLink": "https://github.com/coolio986/ratical/docs/boards/pi"
}
